{
  "version": 1,
  "course": {
    "subject": "Science",
    "topic": "The water cycle",
    "grade": "6",
    "framework": "NGSS",
    "map_objective": "Explain how water moves around the Earth in a never-ending cycle, and what powers it.",
    "pass_mark": 70
  },
  "units": [
    {
      "unit": 1,
      "name": "Water goes up",
      "objective": "Describe how heat from the Sun turns liquid water into water vapour.",
      "standard_codes": [
        "MS-ESS2-4",
        "MS-PS1-4"
      ],
      "due_date": "2026-10-30"
    },
    {
      "unit": 2,
      "name": "Water in the sky",
      "objective": "Explain how water vapour becomes clouds and falls back as rain or snow.",
      "standard_codes": [
        "MS-ESS2-4",
        "MS-ESS2-5"
      ],
      "due_date": "2026-11-06"
    },
    {
      "unit": 3,
      "name": "Water comes back",
      "objective": "Trace where water goes after it falls and how it returns to the sea.",
      "standard_codes": [
        "MS-ESS2-4"
      ],
      "due_date": "2026-11-13"
    }
  ],
  "ideas": [
    {
      "idea_id": "cycle",
      "title": "Water cycle",
      "category": "Process",
      "unit": 3,
      "objective": "I can name the main stages of the water cycle in order.",
      "standard_codes": [
        "MS-ESS2-4"
      ],
      "requires": [
        "evap",
        "cond",
        "prec",
        "coll"
      ],
      "media_url": "water-cycle-overview.mp4",
      "rarity": "auto",
      "notes": "",
      "explanation": "The journey water takes as it moves between the sky, the land and the sea, over and over again."
    },
    {
      "idea_id": "evap",
      "title": "Evaporation",
      "category": "Process",
      "unit": 1,
      "objective": "I can explain how the Sun’s heat turns liquid water into vapour.",
      "standard_codes": [
        "MS-ESS2-4",
        "MS-PS1-4"
      ],
      "requires": [],
      "media_url": "evaporation.mp4",
      "rarity": "auto",
      "notes": "",
      "explanation": "When the Sun warms water in oceans, lakes and puddles, some of it turns into an invisible gas and rises into the air."
    },
    {
      "idea_id": "cond",
      "title": "Condensation",
      "category": "Process",
      "unit": 2,
      "objective": "I can explain why water vapour turns back into drops when it cools.",
      "standard_codes": [
        "MS-ESS2-4",
        "MS-PS1-4"
      ],
      "requires": [
        "evap"
      ],
      "media_url": null,
      "rarity": "auto",
      "notes": "",
      "explanation": "As water vapour rises it cools down and turns back into tiny drops of liquid water."
    },
    {
      "idea_id": "prec",
      "title": "Precipitation",
      "category": "Process",
      "unit": 2,
      "objective": "I can describe what makes water fall from clouds.",
      "standard_codes": [
        "MS-ESS2-4"
      ],
      "requires": [
        "cond"
      ],
      "media_url": "precipitation.mp4",
      "rarity": "auto",
      "notes": "",
      "explanation": "When cloud drops grow too heavy, they fall back to the ground."
    },
    {
      "idea_id": "coll",
      "title": "Collection",
      "category": "Process",
      "unit": 3,
      "objective": "I can list places where fallen water gathers.",
      "standard_codes": [
        "MS-ESS2-4"
      ],
      "requires": [
        "prec"
      ],
      "media_url": null,
      "rarity": "auto",
      "notes": "",
      "explanation": "Water that falls gathers in oceans, rivers, lakes and underground, ready to start the cycle again."
    },
    {
      "idea_id": "trans",
      "title": "Transpiration",
      "category": "Process",
      "unit": 1,
      "objective": "I can explain how plants put water back into the air.",
      "standard_codes": [
        "MS-ESS2-4"
      ],
      "requires": [
        "plants"
      ],
      "media_url": null,
      "rarity": "auto",
      "notes": "",
      "explanation": "Plants pull water up from their roots and let some of it escape from their leaves as vapour."
    },
    {
      "idea_id": "ice",
      "title": "Freezing",
      "category": "Process",
      "unit": 3,
      "objective": "I can explain what happens to water when it freezes.",
      "standard_codes": [
        "MS-PS1-4"
      ],
      "requires": [
        "temp"
      ],
      "media_url": null,
      "rarity": "auto",
      "notes": "",
      "explanation": "When water gets cold enough it turns into solid ice."
    },
    {
      "idea_id": "sun",
      "title": "The Sun",
      "category": "Force",
      "unit": 1,
      "objective": "I can explain why the Sun is the engine of the water cycle.",
      "standard_codes": [
        "MS-ESS2-4"
      ],
      "requires": [],
      "media_url": "sun-energy.mp4",
      "rarity": "auto",
      "notes": "",
      "explanation": "The Sun gives off heat and light. Its energy is what keeps the water cycle moving."
    },
    {
      "idea_id": "temp",
      "title": "Temperature",
      "category": "Force",
      "unit": 1,
      "objective": "I can describe how warming and cooling change water.",
      "standard_codes": [
        "MS-PS1-4"
      ],
      "requires": [
        "sun"
      ],
      "media_url": null,
      "rarity": "auto",
      "notes": "",
      "explanation": "How hot or cold something is. Warm air can hold more water vapour than cold air."
    },
    {
      "idea_id": "climate",
      "title": "Climate",
      "category": "Force",
      "unit": 2,
      "objective": "I can explain how climate affects rain and snow in a place.",
      "standard_codes": [
        "MS-ESS2-6"
      ],
      "requires": [
        "temp",
        "prec"
      ],
      "media_url": null,
      "rarity": "auto",
      "notes": "",
      "explanation": "The usual weather of a place over many years. It changes how much rain and snow falls."
    },
    {
      "idea_id": "vap",
      "title": "Water vapour",
      "category": "Thing",
      "unit": 1,
      "objective": "I can describe water vapour and where it comes from.",
      "standard_codes": [
        "MS-ESS2-4"
      ],
      "requires": [
        "evap"
      ],
      "media_url": "water-vapour.png",
      "rarity": "auto",
      "notes": "",
      "explanation": "Water in the form of a gas. You cannot see it, but it is all around you in the air."
    },
    {
      "idea_id": "clouds",
      "title": "Clouds",
      "category": "Thing",
      "unit": 2,
      "objective": "I can explain what clouds are made of.",
      "standard_codes": [
        "MS-ESS2-5"
      ],
      "requires": [
        "cond"
      ],
      "media_url": "clouds.mp4",
      "rarity": "auto",
      "notes": "",
      "explanation": "Millions of tiny water drops or ice crystals floating together in the sky."
    },
    {
      "idea_id": "rain",
      "title": "Rain & snow",
      "category": "Thing",
      "unit": 2,
      "objective": "I can tell the difference between rain and snow.",
      "standard_codes": [],
      "requires": [
        "prec"
      ],
      "media_url": null,
      "rarity": "auto",
      "notes": "",
      "explanation": "The forms precipitation takes. Snow forms when the air is cold enough to freeze the drops."
    },
    {
      "idea_id": "ocean",
      "title": "Oceans",
      "category": "Thing",
      "unit": 1,
      "objective": "I can explain why oceans matter to the water cycle.",
      "standard_codes": [
        "MS-ESS2-6"
      ],
      "requires": [],
      "media_url": "oceans.jpg",
      "rarity": "auto",
      "notes": "",
      "explanation": "Huge bodies of salt water that cover most of the Earth and hold most of its water."
    },
    {
      "idea_id": "rivers",
      "title": "Rivers",
      "category": "Thing",
      "unit": 3,
      "objective": "I can trace how rivers carry water back to the sea.",
      "standard_codes": [
        "MS-ESS2-4"
      ],
      "requires": [
        "rain"
      ],
      "media_url": null,
      "rarity": "auto",
      "notes": "",
      "explanation": "Flowing fresh water that carries rain and melted snow from the land back to the sea."
    },
    {
      "idea_id": "plants",
      "title": "Plants",
      "category": "Thing",
      "unit": 1,
      "objective": "I can explain how plants take in and give back water.",
      "standard_codes": [
        "MS-LS1-6"
      ],
      "requires": [],
      "media_url": null,
      "rarity": "auto",
      "notes": "",
      "explanation": "Living things that drink water through their roots and return some of it to the air."
    },
    {
      "idea_id": "glacier",
      "title": "Glaciers",
      "category": "Thing",
      "unit": 3,
      "objective": "I can explain how glaciers store and release water.",
      "standard_codes": [
        "MS-ESS2-4"
      ],
      "requires": [
        "ice"
      ],
      "media_url": null,
      "rarity": "auto",
      "notes": "",
      "explanation": "Giant, slow rivers of ice that store fresh water for hundreds of years."
    },
    {
      "idea_id": "ground",
      "title": "Groundwater",
      "category": "Thing",
      "unit": 3,
      "objective": "I can describe how water is stored underground.",
      "standard_codes": [
        "MS-ESS3-1"
      ],
      "requires": [
        "coll",
        "aquifer"
      ],
      "media_url": null,
      "rarity": "auto",
      "notes": "",
      "explanation": "Water that soaks into the soil and is stored between rocks underground."
    }
  ],
  "links": [
    {
      "from_id": "sun",
      "to_id": "evap",
      "relation": "powers",
      "importance": 5,
      "media_url": "how-the-sun-powers-evaporation.mp4"
    },
    {
      "from_id": "evap",
      "to_id": "vap",
      "relation": "creates",
      "importance": 5,
      "media_url": "from-puddle-to-vapour.mp4"
    },
    {
      "from_id": "vap",
      "to_id": "cond",
      "relation": "turns into",
      "importance": 5,
      "media_url": "why-vapour-turns-back-into-drops.mp4"
    },
    {